{
  "id": "software.bitlocker",
  "canonical": "BitLocker",
  "kind": "software",
  "layer": "global",
  "language": "en",
  "aliases": {
    "ru": [
      "битлокер"
    ]
  },
  "ru_equivalent": null,
  "ru_transcription": "Битлокер",
  "policy": "canonical_preferred",
  "ambiguity": "low",
  "auto_replace": true,
  "provenance": {
    "source": "official",
    "source_url": "https://www.microsoft.com/",
    "source_id": null,
    "license": null,
    "confidence": 0.85,
    "last_verified": null
  }
}
