{
  "id": "hardware.ddr4",
  "canonical": "DDR4",
  "kind": "hardware",
  "layer": "global",
  "language": "en",
  "aliases": {},
  "ru_equivalent": null,
  "ru_transcription": null,
  "policy": "canonical_preferred",
  "ambiguity": "low",
  "auto_replace": true,
  "provenance": {
    "source": "official",
    "source_url": "https://www.jedec.org/",
    "source_id": null,
    "license": null,
    "confidence": 0.85,
    "last_verified": null
  }
}
