{
  "id": "brand.alibaba",
  "canonical": "Alibaba",
  "kind": "brand",
  "layer": "global",
  "language": "en",
  "aliases": {
    "ru": [
      "алибаба"
    ]
  },
  "ru_equivalent": null,
  "ru_transcription": "Алибаба",
  "policy": "canonical_preferred",
  "ambiguity": "low",
  "auto_replace": true,
  "provenance": {
    "source": "official",
    "source_url": "https://www.alibabagroup.com/",
    "source_id": null,
    "license": null,
    "confidence": 0.85,
    "last_verified": null
  }
}
