{
  "id": "brand.corsair",
  "canonical": "Corsair",
  "kind": "brand",
  "layer": "global",
  "language": "en",
  "aliases": {
    "ru": [
      "корсар"
    ]
  },
  "ru_equivalent": null,
  "ru_transcription": "Корсар",
  "policy": "canonical_preferred",
  "ambiguity": "low",
  "auto_replace": true,
  "provenance": {
    "source": "official",
    "source_url": "https://www.corsair.com/",
    "source_id": null,
    "license": null,
    "confidence": 0.85,
    "last_verified": null
  }
}
