{
  "id": "software.terraform",
  "canonical": "Terraform",
  "kind": "software",
  "layer": "global",
  "language": "en",
  "aliases": {
    "ru": [
      "терраформ"
    ]
  },
  "ru_equivalent": null,
  "ru_transcription": "Терраформ",
  "policy": "canonical_preferred",
  "ambiguity": "low",
  "auto_replace": true,
  "provenance": {
    "source": "official",
    "source_url": "https://www.terraform.io/",
    "source_id": null,
    "license": null,
    "confidence": 0.85,
    "last_verified": null
  }
}
