{
  "id": "software.go_lang",
  "canonical": "Go",
  "kind": "software",
  "layer": "global",
  "language": "en",
  "aliases": {
    "ru": [
      "голанг"
    ]
  },
  "ru_equivalent": null,
  "ru_transcription": null,
  "policy": "canonical_preferred",
  "ambiguity": "low",
  "auto_replace": true,
  "provenance": {
    "source": "official",
    "source_url": "https://go.dev/",
    "source_id": null,
    "license": null,
    "confidence": 0.85,
    "last_verified": null
  }
}
