{
  "id": "standard.bios",
  "canonical": "BIOS",
  "kind": "standard",
  "layer": "global",
  "language": "en",
  "aliases": {
    "ru": [
      "биос"
    ]
  },
  "ru_equivalent": null,
  "ru_transcription": "Биос",
  "policy": "canonical_preferred",
  "ambiguity": "low",
  "auto_replace": true,
  "provenance": {
    "source": "curated",
    "source_url": null,
    "source_id": null,
    "license": null,
    "confidence": 0.5,
    "last_verified": null
  }
}
