{
  "id": "brand.seagate",
  "canonical": "Seagate",
  "kind": "brand",
  "layer": "global",
  "language": "en",
  "aliases": {
    "ru": [
      "сигейт"
    ]
  },
  "ru_equivalent": null,
  "ru_transcription": "Сигейт",
  "policy": "canonical_preferred",
  "ambiguity": "low",
  "auto_replace": true,
  "provenance": {
    "source": "official",
    "source_url": "https://www.seagate.com/",
    "source_id": null,
    "license": null,
    "confidence": 0.85,
    "last_verified": null
  }
}
